company_name,website,industry,company_size,hq_location,summary_from_llm,automation_pitch_from_llm
OpenAI,https://www.openai.com,Software,201-500,"San Francisco, USA","Based solely on the website text ""Enable JavaScript and cookies to continue,"" we can infer very little about the company itself.  The text only indicates a technical requirement for accessing their website.  However, we can make some educated guesses and propose a solution.

1. **What does this company do?**  We don't know. The website could be for anything – e-commerce, a SaaS application, a news site, a blog, etc.  The requirement for JavaScript and cookies suggests they likely have interactive elements on their site, personalized content, or track user behavior for analytics.  It implies they are not a purely static, informational website.

2. **Who are their target customers?**  Again, we can't be certain. Their target audience depends entirely on the nature of their business. It could be anyone from general consumers to businesses or specific professionals.  More information is needed.

3. **Suggest one AI automation solution QF Innovate could pitch to them.**  Given the limited information, a safe bet would be an **AI-powered website performance monitoring and optimization solution**.  This solution could:

    * **Automatically detect JavaScript and cookie-related errors:**  This would proactively identify issues impacting user experience and website accessibility.  The solution would alert the company to problems before they affect a significant number of users, minimizing negative impacts on conversion rates and brand reputation.
    * **Analyze user behavior data:**  Using AI, the solution could analyze cookie data to understand user journeys, identify bottlenecks, and suggest improvements to the website design and functionality. This could lead to higher conversion rates and improved user engagement.
    * **Automate website maintenance and updates:**  This could help ensure that JavaScript and cookies are always functioning optimally.

This solution addresses a potential pain point (website accessibility and performance) and leverages AI to provide value, without needing specific knowledge about the company's industry or target market.  A more tailored pitch would require more information about the company and its website.
",Refer to the summary above
DeepMind,https://www.deepmind.com,Software,201-500,"San Francisco, USA","Here's an analysis of the provided text, answering your questions:

**1. What does this company do?**

Google DeepMind is a company that develops and researches next-generation artificial intelligence (AI) systems.  Their work spans several areas:

* **Building and deploying powerful AI models:**  They create large language models (like Gemini), generative models (for image, music, and video), and other specialized AI systems for various applications.
* **Conducting fundamental AI research:** They push the boundaries of AI through research projects in diverse fields like biology, climate science, mathematics, and physics.
* **Developing AI tools and applications:** They create practical AI tools and technologies to address real-world problems.
* **Promoting responsible AI development:** They emphasize the ethical and safety aspects of AI development and deployment.


**2. Who are their target customers?**

Google DeepMind's target customers are multifaceted and include:

* **Developers and Businesses:** Companies wanting to integrate advanced AI models into their products and services (e.g., using Gemini for chatbots, Imagen for image generation).
* **Researchers:**  Academics and researchers in various fields who can leverage their models and datasets for their own studies.
* **Government and Organizations:** Entities needing powerful AI solutions for specific tasks, like climate modeling or biological research.
* **The General Public (indirectly):**  The ultimate beneficiaries are the public through the applications and advancements that result from their research and development efforts.


**3. Suggest one AI automation solution QF Innovate could pitch to Google DeepMind.**

Given Google DeepMind's focus on large-scale AI model training and experimentation, QF Innovate could pitch an **AI-powered automated model experimentation and hyperparameter optimization platform**.

**Pitch Outline:**

* **Problem:**  Training and optimizing large AI models is computationally expensive and time-consuming. Manually exploring different architectures, hyperparameters, and training strategies is inefficient.
* **Solution:**  QF Innovate's platform would automate the entire process. It would use AI to:
    * **Suggest optimal hyperparameter settings:** Based on prior experiments and model characteristics, minimizing the need for manual tuning.
    * **Automate model architecture search:** Explore various neural network architectures to find the most efficient and effective one for a given task.
    * **Manage and optimize distributed training:** Efficiently allocate resources across multiple GPUs/TPUs to speed up training.
    * **Track and visualize experiments:** Provide a centralized dashboard for monitoring progress, comparing results, and identifying trends.
* **Benefits:**  Significant reduction in training time and cost, improved model performance, and accelerated research and development cycles.  This would allow Google DeepMind's researchers to focus on more innovative and high-level tasks.

This solution directly addresses a key challenge faced by Google DeepMind – the need for efficiency and automation in their already extensive AI development process.  It aligns perfectly with their scale and ambitions.
",Refer to the summary above
Zoho,https://www.zoho.com,Software,201-500,"San Francisco, USA","Here's a breakdown of the provided text, answering your questions:

1. **What does this company do?**

Zoho provides a comprehensive cloud-based software suite for businesses of all sizes.  Their offerings include CRM, email services, accounting software, HR management tools, helpdesk software, and much more, all integrated under the Zoho One umbrella.  Essentially, they aim to be a one-stop shop for all a business's software needs.

2. **Who are their target customers?**

Zoho targets businesses of all sizes, from startups to large enterprises.  The testimonials included represent a range of company sizes and industries, highlighting their broad appeal.

3. **Suggest one AI automation solution QF Innovate could pitch to Zoho.**

Given Zoho's focus on integrating various business functions, QF Innovate could pitch an **AI-powered solution for intelligent workflow automation across Zoho One**.  This solution could analyze data from different Zoho applications (CRM, email, accounting, etc.) to identify bottlenecks, predict future needs, and automatically route tasks and information to the appropriate personnel.  

For example, the AI could:

* **Automate lead qualification in the CRM:** By analyzing lead data (website activity, email engagement, etc.), the AI could automatically score leads and prioritize those most likely to convert, freeing up sales reps to focus on high-potential prospects.
* **Optimize scheduling and resource allocation:**  Based on project deadlines and employee availability (data from Zoho People), the AI could automatically schedule tasks and allocate resources efficiently, reducing delays and improving productivity.
* **Improve customer service response times:** By analyzing incoming support tickets (from Zoho Desk), the AI could automatically route tickets to the most appropriate agent, identify frequently asked questions, and even offer pre-written responses, leading to faster resolution times.
* **Proactive issue detection and alerts:**  By analyzing data across multiple Zoho applications, the AI could identify potential problems before they escalate, such as predicting cash flow issues based on accounting data or flagging potential customer churn based on CRM data.


This AI-powered workflow automation would enhance Zoho One's capabilities, offering significant value to their existing customers and attracting new ones by showcasing advanced automation capabilities.  The pitch should emphasize integration with existing Zoho products and ease of implementation to maximize appeal.
",Refer to the summary above
Freshworks,https://www.freshworks.com,Software,201-500,"San Francisco, USA","Based on the provided error message, we can infer some things about the company but not definitively identify their business.  The error message comes from CloudFront, a content delivery network (CDN) service offered by Amazon Web Services (AWS).

1. **What does this company do?**

The company uses Amazon CloudFront to deliver content to its customers.  This suggests they are a company that relies on a website or app to serve content, but we don't know the *nature* of their content. They could be:

* **An e-commerce business:** Selling products online.
* **A media company:** Streaming videos, offering downloadable content.
* **A SaaS company:** Providing software as a service.
* **A blog or news website:** Publishing articles and information.

The error message itself doesn't specify the company's core business activity beyond needing a CDN to distribute its content.


2. **Who are their target customers?**

This depends entirely on what the company actually *does*.  Their target customers are the end-users who access their website or app.  However, the CloudFront mention highlights that their *technical* target audience is developers and IT professionals who manage their website infrastructure.


3. **Suggest one AI automation solution QF Innovate could pitch to them.**

Given the error message points to potential traffic spikes or configuration issues, QF Innovate could pitch an **AI-powered website performance monitoring and optimization solution**.  This solution could:

* **Proactively identify and predict traffic spikes:**  Using machine learning, it could analyze historical traffic patterns and predict future surges, allowing the company to proactively scale their infrastructure to avoid 403 errors.
* **Automatically adjust resource allocation:** Based on real-time traffic demands, the AI could dynamically scale server capacity, ensuring optimal performance even during peak usage.
* **Diagnose and resolve configuration errors:** AI could analyze error logs and website performance metrics to identify and suggest solutions for configuration issues that might be causing the 403 errors.  This could help prevent future occurrences.
* **Improve content delivery:** AI could optimize content delivery based on user location and device type, ensuring faster loading times and better user experience.


This solution directly addresses the problem highlighted in the error message and demonstrates value by improving website reliability, scalability, and user experience.  The pitch should focus on the cost savings from preventing downtime and improving customer satisfaction.
",Refer to the summary above
